{
  "claim": {
    "property": "no cross-tenant cache reuse on a byte-identical prefix"
  },
  "confidence": {
    "bound_type": "false_pass_rate_upper",
    "coverage_level": 0.95,
    "false_pass_bound": 0.0,
    "machine_checked": false,
    "method": "exhaustive-model-count",
    "n_samples": 100,
    "paper": "exact enumeration",
    "scope": "one engine build, one GPU class; static co-batching only"
  },
  "digests": {
    "record_sha256": "f5a59a3e67437e570a5bf8528efd1307250a7c019bff8dd56b4637e6aad0e632",
    "semantic_sha256": "c407354e7f113ae71a7351aad0524f14945bdfa5ec14264487519f0528dfbdc1"
  },
  "domain": "kv-isolation",
  "evidence": {
    "enumerated": 20736,
    "state_space": 20736
  },
  "gate": {
    "legs": {
      "partition_bound": true,
      "salt_present": true
    },
    "name": "demo-gate",
    "provenance": "conformance corpus"
  },
  "honesty": {
    "aspirational": [],
    "non_claims": [
      "does not measure throughput",
      "no claim about any commercial provider"
    ],
    "proven": [],
    "simulated": []
  },
  "schema": "signoff-cert/v1",
  "signature": {
    "alg": "HMAC-SHA256",
    "key_id": "conformance",
    "sig": "44dcac956f473323de3b54d3ac1902a30d3b4524b2bb74fc8b986eea89c03021"
  },
  "subject": {
    "artifact_digests": {
      "config": "aaaaaaaaaaaaaaaaaaaaaaaaaaaaaaaaaaaaaaaaaaaaaaaaaaaaaaaaaaaaaaaa"
    },
    "id": "demo-subject"
  },
  "verdict": "ADMITTED"
}