{
  "claim": {
    "property": "no cross-tenant cache reuse on a byte-identical prefix"
  },
  "confidence": {
    "bound_type": "false_pass_rate_upper",
    "coverage_level": 0.95,
    "false_pass_bound": 0.02951304959181542,
    "machine_checked": false,
    "method": "clopper-pearson",
    "n_samples": 100,
    "paper": "Clopper-Pearson 1934",
    "scope": "one engine build, one GPU class; static co-batching only"
  },
  "digests": {
    "record_sha256": "de439a3ca0716314b679c33f06193b1f7ab490501cebd108b307754efeaa6ae0",
    "semantic_sha256": "c407354e7f113ae71a7351aad0524f14945bdfa5ec14264487519f0528dfbdc1"
  },
  "domain": "kv-isolation",
  "evidence": {
    "k": 0,
    "n": 100
  },
  "gate": {
    "legs": {
      "partition_bound": true,
      "salt_present": true
    },
    "name": "demo-gate",
    "provenance": "conformance corpus"
  },
  "honesty": {
    "aspirational": [],
    "non_claims": [
      "does not measure throughput",
      "no claim about any commercial provider"
    ],
    "proven": [],
    "simulated": []
  },
  "schema": "signoff-cert/v1",
  "signature": {
    "alg": "HMAC-SHA256",
    "key_id": "conformance",
    "sig": "46dfca4d2740ed6f36942be79fc89867e8c90c57d72a3f93fc9f64b4f5722c59"
  },
  "subject": {
    "artifact_digests": {
      "config": "aaaaaaaaaaaaaaaaaaaaaaaaaaaaaaaaaaaaaaaaaaaaaaaaaaaaaaaaaaaaaaaa"
    },
    "id": "demo-subject"
  },
  "verdict": "ADMITTED"
}